{
  "schemaVersion": "2.0",
  "curriculumId": "GOLDEN",
  "revision": 1,
  "title": "Golden Curriculum",
  "shortTitle": "Golden",
  "target": {
    "role": "Structured Problem Solver",
    "learner": "Beginning learner",
    "professionalOutcome": "Use a small repeatable process to investigate, explain, and improve a simple problem.",
    "specialGoals": ["structured investigation", "clear evidence"]
  },
  "workload": {
    "weeklyHours": { "min": 6, "max": 8 },
    "estimatedTotalHours": 12,
    "estimatedWeeks": 2
  },
  "assumptions": [
    "This curriculum is a structural fixture, not a production learning recommendation.",
    "All example.com resources are intentionally unverified placeholders."
  ],
  "phases": [
    {
      "id": "GOLDEN-PH01",
      "title": "Observe and Improve",
      "outcome": "Develop and apply a small evidence-based improvement loop."
    }
  ],
  "competencies": [
    {
      "id": "GOLDEN-C001",
      "name": "Record an observable problem",
      "description": "Describe a problem using specific observable facts instead of an unsupported conclusion.",
      "domain": "Investigation",
      "importance": "core",
      "prerequisiteIds": []
    },
    {
      "id": "GOLDEN-C002",
      "name": "Test one proposed change",
      "description": "Change one factor and record whether the observable result changes.",
      "domain": "Investigation",
      "importance": "core",
      "prerequisiteIds": ["GOLDEN-C001"]
    },
    {
      "id": "GOLDEN-C003",
      "name": "Explain an evidence-based improvement",
      "description": "Compare observations before and after a change and explain what the evidence supports.",
      "domain": "Communication",
      "importance": "core",
      "prerequisiteIds": ["GOLDEN-C002"]
    }
  ],
  "resources": [
    {
      "id": "GOLDEN-R001",
      "title": "Example: Observable Problem Notes",
      "url": "https://example.com/golden/observable-problems",
      "provider": "XcelerateAI structural fixture",
      "format": "article",
      "cost": "free",
      "estimatedMinutes": 25,
      "location": { "note": "Read the complete structural example." },
      "competencyIds": ["GOLDEN-C001"],
      "whySelected": "Placeholder content used to exercise a Core explanatory resource assignment."
    },
    {
      "id": "GOLDEN-R002",
      "title": "Example Exercise: Change One Factor",
      "url": "https://example.com/golden/change-one-factor",
      "provider": "XcelerateAI structural fixture",
      "format": "exercise",
      "cost": "free",
      "estimatedMinutes": 35,
      "location": { "start": "Exercise 1", "stop": "Reflection prompt" },
      "competencyIds": ["GOLDEN-C002"],
      "whySelected": "Placeholder exercise used to provide explicit deterministic practice evidence."
    },
    {
      "id": "GOLDEN-R003",
      "title": "Optional Example: Investigation Walkthrough",
      "url": "https://example.com/golden/investigation-walkthrough",
      "provider": "XcelerateAI structural fixture",
      "format": "video",
      "cost": "free",
      "estimatedMinutes": 20,
      "location": { "start": "00:00", "stop": "08:00" },
      "competencyIds": ["GOLDEN-C001", "GOLDEN-C002"],
      "whySelected": "Placeholder alternative explanation that is intentionally optional."
    },
    {
      "id": "GOLDEN-R004",
      "title": "Example: Comparing Before and After",
      "url": "https://example.com/golden/before-after",
      "provider": "XcelerateAI structural fixture",
      "format": "article",
      "cost": "free",
      "estimatedMinutes": 25,
      "location": { "note": "Read the complete structural example." },
      "competencyIds": ["GOLDEN-C001", "GOLDEN-C003"],
      "whySelected": "Placeholder explanation that reinforces observation and introduces evidence-based comparison."
    },
    {
      "id": "GOLDEN-R005",
      "title": "Example Lab: Improvement Report",
      "url": "https://example.com/golden/improvement-report-lab",
      "provider": "XcelerateAI structural fixture",
      "format": "lab",
      "cost": "free",
      "estimatedMinutes": 45,
      "location": { "start": "Scenario", "stop": "Completed report" },
      "competencyIds": ["GOLDEN-C002", "GOLDEN-C003"],
      "whySelected": "Placeholder lab used to exercise explicit practice and reinforcement coverage."
    },
    {
      "id": "GOLDEN-R006",
      "title": "Optional Example: Evidence Language Reference",
      "url": "https://example.com/golden/evidence-language",
      "provider": "XcelerateAI structural fixture",
      "format": "documentation",
      "cost": "free",
      "estimatedMinutes": 15,
      "location": { "note": "Use only when an additional wording reference is useful." },
      "competencyIds": ["GOLDEN-C003"],
      "whySelected": "Placeholder optional reference for additional explanation."
    }
  ],
  "weeks": [
    {
      "id": "GOLDEN-W01",
      "sequence": 1,
      "phaseId": "GOLDEN-PH01",
      "title": "Observe and Test",
      "outcome": "Record one observable problem and test one controlled change.",
      "competencyIds": ["GOLDEN-C001", "GOLDEN-C002"],
      "estimatedHours": 6,
      "study": {
        "objective": "Distinguish observations from conclusions and practice changing one factor.",
        "coreMinimum": 2,
        "resources": [
          {
            "resourceId": "GOLDEN-R001",
            "role": "core",
            "competencyIds": ["GOLDEN-C001"],
            "purpose": "Primary explanation of observable problem records."
          },
          {
            "resourceId": "GOLDEN-R002",
            "role": "core",
            "competencyIds": ["GOLDEN-C002"],
            "purpose": "Guided practice changing one factor."
          },
          {
            "resourceId": "GOLDEN-R003",
            "role": "optional",
            "competencyIds": ["GOLDEN-C001", "GOLDEN-C002"],
            "purpose": "Alternative walkthrough for reinforcement."
          }
        ]
      },
      "skillCheck": {
        "id": "GOLDEN-SC-W01",
        "title": "Observation and Testing Check",
        "instructions": "Choose the best answer for each question.",
        "passingScore": 70,
        "competencyIds": ["GOLDEN-C001", "GOLDEN-C002"],
        "questions": [
          { "id": "GOLDEN-Q-W01-01", "competencyIds": ["GOLDEN-C001"], "prompt": "Which note is an observable fact?", "options": [{"id":"a","label":"The page displayed an error code."},{"id":"b","label":"The system is badly designed."},{"id":"c","label":"The developer was careless."},{"id":"d","label":"The tool never works."}], "correctOptionId": "a", "explanation": "An displayed error code is directly observable; the other choices are unsupported conclusions." },
          { "id": "GOLDEN-Q-W01-02", "competencyIds": ["GOLDEN-C001"], "prompt": "What should a useful first problem record include?", "options": [{"id":"a","label":"Only a proposed solution"},{"id":"b","label":"What happened and how it was observed"},{"id":"c","label":"A guess about who caused it"},{"id":"d","label":"No reproducible detail"}], "correctOptionId": "b", "explanation": "A useful record begins with the observable behavior and its context." },
          { "id": "GOLDEN-Q-W01-03", "competencyIds": ["GOLDEN-C002"], "prompt": "Why change one factor at a time?", "options": [{"id":"a","label":"To make the test longer"},{"id":"b","label":"To avoid recording results"},{"id":"c","label":"To better connect a changed result to the tested factor"},{"id":"d","label":"To guarantee success"}], "correctOptionId": "c", "explanation": "Controlling other factors makes the evidence easier to interpret." },
          { "id": "GOLDEN-Q-W01-04", "competencyIds": ["GOLDEN-C002"], "prompt": "A test changes three settings and the problem disappears. What is known?", "options": [{"id":"a","label":"Exactly which setting fixed it"},{"id":"b","label":"All settings were required"},{"id":"c","label":"The original observation was false"},{"id":"d","label":"The combined change altered the result, but the responsible factor is unclear"}], "correctOptionId": "d", "explanation": "Multiple simultaneous changes prevent attributing the outcome to one factor." },
          { "id": "GOLDEN-Q-W01-05", "competencyIds": ["GOLDEN-C001"], "prompt": "Which wording avoids an unsupported conclusion?", "options": [{"id":"a","label":"The request returned status 500 twice."},{"id":"b","label":"The server is hopeless."},{"id":"c","label":"The library is broken."},{"id":"d","label":"Nothing can fix this."}], "correctOptionId": "a", "explanation": "The status and repetition are recorded observations." },
          { "id": "GOLDEN-Q-W01-06", "competencyIds": ["GOLDEN-C002"], "prompt": "What should be recorded after a controlled change?", "options": [{"id":"a","label":"Only whether the learner liked it"},{"id":"b","label":"The result observed under the changed condition"},{"id":"c","label":"A different unrelated problem"},{"id":"d","label":"Nothing if the change failed"}], "correctOptionId": "b", "explanation": "Both successful and unsuccessful test results provide evidence." },
          { "id": "GOLDEN-Q-W01-07", "competencyIds": ["GOLDEN-C001", "GOLDEN-C002"], "prompt": "Which sequence supports a defensible test?", "options": [{"id":"a","label":"Conclude, guess, stop"},{"id":"b","label":"Change everything, then observe"},{"id":"c","label":"Observe, change one factor, observe again"},{"id":"d","label":"Copy a conclusion without testing"}], "correctOptionId": "c", "explanation": "The sequence establishes a baseline and a comparable result." },